{
    "$schema": "../../resources/schemas/module.json",
    "name": "recordings",
    "version": "1.0.0",
    "namespace": "Modules\\Recordings",
    "display_name": "Recordings",
    "category": "media",
    "description": "Audio recording management for FreeSWITCH",
    "required": false,
    "protected": false,
    "priority": 350,
    "providers": [
        "Modules\\Recordings\\Providers\\ModuleServiceProvider"
    ],
    "requirements": {
        "php": ">=8.5",
        "laravel": ">=13.0",
        "modules": [
            "file-stores"
        ],
        "packages": []
    }
}
