{
    "$schema": "../../resources/schemas/module.json",
    "name": "hot-desking",
    "version": "1.0.0",
    "namespace": "Modules\\HotDesking",
    "display_name": "Hot Desking",
    "category": "features",
    "description": "Manage hot desking device and extension mobility",
    "required": false,
    "protected": false,
    "priority": 0,
    "providers": [
        "Modules\\HotDesking\\Providers\\ModuleServiceProvider"
    ],
    "requirements": {
        "php": ">=8.3",
        "laravel": ">=13.0",
        "modules": [
            "devices",
            "extensions"
        ],
        "packages": []
    }
}
