{
    "$schema": "../../resources/schemas/module.json",
    "name": "number-translations",
    "version": "1.0.0",
    "namespace": "Modules\\NumberTranslations",
    "display_name": "Number Translations",
    "category": "routing",
    "description": "Number translation and manipulation rules",
    "required": false,
    "protected": false,
    "priority": 610,
    "providers": [
        "Modules\\NumberTranslations\\Providers\\ModuleServiceProvider"
    ],
    "requirements": {
        "php": ">=8.5",
        "laravel": ">=13.0",
        "modules": [],
        "packages": []
    }
}
