{
    "$schema": "../../resources/schemas/module.json",
    "name": "event-rate-limits",
    "version": "1.0.0",
    "namespace": "Modules\\EventRateLimits",
    "display_name": "Event Rate Limits",
    "category": "advanced",
    "description": "FreeSWITCH event rate limiting configuration",
    "required": false,
    "protected": false,
    "priority": 520,
    "providers": [
        "Modules\\EventRateLimits\\Providers\\ModuleServiceProvider"
    ],
    "requirements": {
        "php": ">=8.5",
        "laravel": ">=13.0",
        "modules": [],
        "packages": []
    }
}
