{
    "$schema": "../../resources/schemas/module.json",
    "name": "sip-status",
    "version": "1.0.0",
    "namespace": "Modules\\SipStatus",
    "display_name": "SIP Status",
    "category": "monitoring",
    "description": "SIP profile and gateway status for FreeSWITCH",
    "required": false,
    "protected": false,
    "priority": 450,
    "providers": [
        "Modules\\SipStatus\\Providers\\ModuleServiceProvider"
    ],
    "requirements": {
        "php": ">=8.3",
        "laravel": ">=13.0",
        "modules": [],
        "packages": []
    }
}
