{
    "$schema": "../../resources/schemas/module.json",
    "name": "operator-panel",
    "version": "1.0.0",
    "namespace": "Modules\\OperatorPanel",
    "display_name": "Operator Panel",
    "category": "monitoring",
    "description": "Visual operator panel for FreeSWITCH",
    "required": false,
    "protected": false,
    "priority": 480,
    "providers": [
        "Modules\\OperatorPanel\\Providers\\ModuleServiceProvider"
    ],
    "requirements": {
        "php": ">=8.3",
        "laravel": ">=13.0",
        "modules": [
            "extensions"
        ],
        "packages": []
    }
}
