{
    "$schema": "../../resources/schemas/module.json",
    "name": "sip-trunks",
    "version": "1.0.0",
    "namespace": "Modules\\SipTrunks",
    "display_name": "SIP Trunks",
    "category": "connectivity",
    "description": "SIP trunk management",
    "required": false,
    "protected": false,
    "priority": 540,
    "providers": [
        "Modules\\SipTrunks\\Providers\\ModuleServiceProvider"
    ],
    "requirements": {
        "php": ">=8.5",
        "laravel": ">=13.0",
        "modules": [],
        "packages": []
    }
}
