{
    "$schema": "../../resources/schemas/module.json",
    "name": "sip-profiles",
    "version": "1.0.0",
    "namespace": "Modules\\SipProfiles",
    "display_name": "SIP Profiles",
    "category": "connectivity",
    "description": "Manage FreeSWITCH Sofia SIP profiles with per-tenant JSON settings.",
    "required": true,
    "protected": true,
    "priority": 130,
    "providers": [
        "Modules\\SipProfiles\\Providers\\ModuleServiceProvider"
    ],
    "requirements": {
        "php": ">=8.5",
        "laravel": ">=13.0",
        "modules": [
            "gateways"
        ],
        "packages": []
    }
}
