{
    "$schema": "../../resources/schemas/module.json",
    "name": "email-templates",
    "version": "1.0.0",
    "namespace": "Modules\\EmailTemplates",
    "display_name": "Email Templates",
    "category": "advanced",
    "description": "Notification template editor",
    "required": false,
    "protected": false,
    "priority": 530,
    "providers": [
        "Modules\\EmailTemplates\\Providers\\ModuleServiceProvider"
    ],
    "requirements": {
        "php": ">=8.5",
        "laravel": ">=13.0",
        "modules": [],
        "packages": []
    }
}
