{
    "$schema": "../../resources/schemas/module.json",
    "name": "call-centers",
    "version": "1.0.0",
    "namespace": "Modules\\CallCenters",
    "display_name": "Call Centers",
    "category": "features",
    "description": "Call center queue management for FreeSWITCH",
    "required": false,
    "protected": false,
    "priority": 460,
    "providers": [
        "Modules\\CallCenters\\Providers\\ModuleServiceProvider"
    ],
    "requirements": {
        "php": ">=8.3",
        "laravel": ">=13.0",
        "modules": [],
        "packages": []
    }
}
