{
    "$schema": "../../resources/schemas/module.json",
    "name": "registrations",
    "version": "1.0.0",
    "namespace": "Modules\\Registrations",
    "display_name": "Registrations",
    "category": "monitoring",
    "description": "SIP registration monitoring for FreeSWITCH",
    "required": false,
    "protected": false,
    "priority": 440,
    "providers": [
        "Modules\\Registrations\\Providers\\ModuleServiceProvider"
    ],
    "requirements": {
        "php": ">=8.3",
        "laravel": ">=13.0",
        "modules": [],
        "packages": []
    }
}
