{
    "$schema": "../../resources/schemas/module.json",
    "name": "admin",
    "version": "1.0.0",
    "namespace": "Modules\\Admin",
    "display_name": "Admin",
    "category": "core",
    "description": "Core administration module providing the management UI.",
    "required": true,
    "protected": true,
    "priority": 90,
    "providers": [
        "Modules\\Admin\\Providers\\ModuleServiceProvider"
    ],
    "requirements": {
        "php": ">=8.5",
        "laravel": ">=13.0",
        "modules": [
            "backups"
        ],
        "packages": []
    }
}
