{
    "$schema": "../../resources/schemas/module.json",
    "name": "extensions",
    "version": "1.0.0",
    "namespace": "Modules\\Extensions",
    "display_name": "Extensions",
    "category": "accounts",
    "description": "Manage tenant-local phone extensions and extension-level settings.",
    "required": true,
    "protected": true,
    "priority": 220,
    "providers": [
        "Modules\\Extensions\\Providers\\ModuleServiceProvider"
    ],
    "requirements": {
        "php": ">=8.5",
        "laravel": ">=13.0",
        "modules": [
            "sip-accounts",
            "voicemails"
        ],
        "packages": []
    }
}
