{
    "$schema": "../../resources/schemas/module.json",
    "name": "call-center-active",
    "version": "1.0.0",
    "namespace": "Modules\\CallCenterActive",
    "display_name": "Call Center Active",
    "category": "monitoring",
    "description": "Live call center queue monitoring",
    "required": false,
    "protected": false,
    "priority": 470,
    "providers": [
        "Modules\\CallCenterActive\\Providers\\ModuleServiceProvider"
    ],
    "requirements": {
        "php": ">=8.5",
        "laravel": ">=13.0",
        "modules": [],
        "packages": []
    }
}
