{
    "$schema": "../../resources/schemas/module.json",
    "name": "emergency",
    "version": "1.0.0",
    "namespace": "Modules\\Emergency",
    "display_name": "Emergency (E911)",
    "category": "routing",
    "description": "Emergency call configuration and location",
    "required": false,
    "protected": false,
    "priority": 670,
    "providers": [
        "Modules\\Emergency\\Providers\\ModuleServiceProvider"
    ],
    "requirements": {
        "php": ">=8.5",
        "laravel": ">=13.0",
        "modules": [
            "gateways"
        ],
        "packages": []
    }
}
