{
    "$schema": "../../resources/schemas/module.json",
    "name": "gateways",
    "version": "1.0.0",
    "namespace": "Modules\\Gateways",
    "display_name": "Gateways",
    "category": "accounts",
    "description": "Manage SIP trunks and upstream provider connections for outbound routing.",
    "required": true,
    "protected": true,
    "priority": 140,
    "providers": [
        "Modules\\Gateways\\Providers\\ModuleServiceProvider"
    ],
    "requirements": {
        "php": ">=8.3",
        "laravel": ">=13.0",
        "modules": [],
        "packages": []
    }
}
