{
    "$schema": "../../resources/schemas/module.json",
    "name": "click-to-call",
    "version": "1.0.0",
    "namespace": "Modules\\ClickToCall",
    "display_name": "Click to Call",
    "category": "features",
    "description": "Click-to-call widget",
    "required": false,
    "protected": false,
    "priority": 680,
    "providers": [
        "Modules\\ClickToCall\\Providers\\ModuleServiceProvider"
    ],
    "requirements": {
        "php": ">=8.5",
        "laravel": ">=13.0",
        "modules": [],
        "packages": []
    }
}
