{
    "$schema": "../../resources/schemas/module.json",
    "name": "extension-settings",
    "version": "1.0.0",
    "namespace": "Modules\\ExtensionSettings",
    "display_name": "Extension Settings",
    "category": "accounts",
    "description": "Per-extension feature overrides",
    "required": false,
    "protected": false,
    "priority": 630,
    "providers": [
        "Modules\\ExtensionSettings\\Providers\\ModuleServiceProvider"
    ],
    "requirements": {
        "php": ">=8.5",
        "laravel": ">=13.0",
        "modules": [
            "extensions"
        ],
        "packages": []
    }
}
